full_nameyears,sentence,label,sentiment_label,sentiment_score
Estrada-2000,never tolerate election fraud since cheated first ran mayor san juan.,,,
Estrada-2000,know feels cheated.,,,
Estrada-2000,"fortunately, supreme court declared winner.",,,
Estrada-2000,"admittedly, past two years, presidency struggled challenges coping learning curve made difficult longlasting effects corporate sector asian financial crisis vicious attempts detractors discredit family.",,,
Estrada-2000,attacks started way back campaign never let up.,,,
Estrada-2000,"unfortunately, discrediting me, head state government, also undermine confidence international community country, thereby damage prospects economy.",,,
Estrada-2000,"sa halip na tayo ay magsiraan, kailangang magkaisa magtulungan tayo sa darating na apat na taon upang mapabilis ang ating pagunlad.",,,
Estrada-2000,"habang tayo ay nagsisiraan nagaawayaway, nagpapalakpakan naman ang ating karatigbansa dahil sa kanila pumupunta ang mga dayuhang kapitalista mga turista.",,,
Estrada-2000,"nonetheless, presidency learned lessons well.",,,
Estrada-2000,"point, presidency poised new beginnings.",,,
Estrada-2000,"assure crystalclear transparency government transactions remove opportunities abuse government officials, wish make following announcements.",,,
Estrada-2000,"long president, negotiated contracts government procurements, public works, construction projects.",,,
Estrada-2000,never allow another amari centennial expo happen ever again.,,,
Estrada-2000,supply construction contracts awarded public bidding.,,,
Estrada-2000,"make doubly sure future bids completely transparent, government resort electronic public biddings, socalled reverse auction method, bids suppliers contractors posted website.",,,
Estrada-2000,brings transparency new dimension.,,,
Estrada-2000,"long president, government guarantees issued loans private firms.",,,
Estrada-2000,creditors shielded governments sovereign guarantees market risks bear.,,,
Estrada-2000,risks borne taxpayers.,,,
Estrada-2000,"guarantees given restrictive conditions, provided bot law.",,,
Estrada-2000,"shall next administration last one mine, namely, hand multibillionpeso guarantees failed negotiated projects administration honor pay.",,,
Estrada-2000,"government financial institution shall extend new loans, shall government agency enter new contracts, bad records unresolved disputes government.",,,
Estrada-2000,curb smuggling rationalizing operation dutyfree shops.,,,
Estrada-2000,"confine traditional merchandise, like alcoholic beverages cigarettes carried plastic bags, frozen chickens cheese curls loaded grocery shopping carts consumers purchase chocolate bars, refrigerators store in.",,,
Estrada-2000,"duty freeshops operate supermarkets, vice versa.",,,
Estrada-2000,"ordered agencies concerned carry investigation and, warranted, prosecution suspected illegal involvement trading shares bw resources.",,,
Estrada-2000,"incidentally, wish thank honorable members congress passing new securities regulation act, provides stronger protection investors fraud strengthens capabilities securities exchange commission.",,,
Estrada-2000,"hereby order concerned agencies resolve air dispute taiwan shortest time possible, taking account interests ofws, balikbayans, tourists, well cargo shippers.",,,
Estrada-2000,reshape aviation policies promote primarily interests economy.,,,
Estrada-2000,"conclude, wish extend administrations gratitude appreciation honorable members congress acting significant number measures.",,,
Estrada-2000,"enacted large number important laws affecting economy, including electronic commerce law, safeguard measures act, securities regulation code, retail trade liberalization law, among others.",,,
Estrada-2000,congress worked long hard deliver measures.,,,
Estrada-2000,alam ko pong inuumaga kayo sa inyong mga sesyon ako po naman ay tauspusong nagpapasalamat sa inyong lahat.,,,
Estrada-2000,ngunit hindi pa tayo tapos.,,,
Estrada-2000,may utang pa tayo sa bayan.,,,
Estrada-2000,"umaasa ako na inyong pagtitibayin ang mga panukalang batas tulad ng amendments armm organic act, power bill, new central bank act, comprehensive solid waste management act, reengineering bureaucracy act, antiracketeering act, amendments omnibus investment code, bill granting special powers fasttrack development mindanao.",,,
Estrada-2000,"ayan, ihinuli ko na yung special power.",,,
Estrada-2000,"hindi emergency power, special power lamang.",,,
Estrada-2000,pero nasa inyo na yon.,,,
Estrada-2000,"conclude, due candor done quite well, could done better.",,,
Estrada-2000,"gone quite far, far want go.",,,
Estrada-2000,"tell story success, go story struggle.",,,
Estrada-2000,weather ahead bit rough get see real sunshine.,,,
Estrada-2000,"face difficulties confront, call whole country work together unison rather fall apart dissension.",,,
Estrada-2000,ride storm unite.,,,
Estrada-2000,blow us apart fight.,,,
Estrada-2000,also call affluent pay taxes correctly.,,,
Estrada-2000,"one thing worse spending enough propoor programs, running excessive deficits allowing inflation macroeconomic instability rob poor.",,,
Estrada-2000,"present uncertainties call courage, hope, faith ability cope prevail.",,,
Estrada-2000,"face challenges proper spirit, survive storm thrive sunshine returns.",,,
Estrada-2000,"brought presidency process renewal, ask give trust support.",,,
Estrada-2000,"let us leave past disappointments behind, let us shape future together.",,,
Estrada-2000,let us embark new beginning.,,,
Estrada-2000,"said earlier, , days left presidency.",,,
Estrada-2000,ang tunay nating kalaban ay ang kahirapan.,,,
Estrada-2000,"inaamin ko na kahit na ako ang pangulo, hindi ko kayang labanan ito nang nagiisa.",,,
Estrada-2000,kaya kailangan ko ang tulong ninyong lahat.,,,
Estrada-2000,"magkaisa na po tayo alangalang sa ating bayan sa ating mga anak na dapat na bigyan natin ng isang mapayapa, maunlad, magandang kinabukasan.",,,
Estrada-2000,maraming salamat po.,,,
Estrada-2000,"first state nation addressby gloria president philippinesopening regular session congress excellency president ramos senate president drilon senators speaker de venecia congressmen congresswomen justices supreme court members diplomatic corps mga maralitang tagalungsod na nanonood ngayon sa video wall sa tv mga maraming nakikinig sa radyo mahal kong kababayan kamakailan, may sumulat sa aking tatlong batang tagapayatas, sina jayson, jomar, erwin.",,,
Estrada-2000,ginawa nilang paper boats ang liham pinalutang sa pasig river patungo sa malacañang.,,,
Estrada-2000,ito ang sinulat ng sampung taong gulang na si jomar pabalan sana po ay mabigyan ng permanenteng trabaho ang tatay ko para hindi siya mahirapan.,,,
Estrada-2000,"sabi naman ni jason vann banogan, taong gulang sana po matulungan ninyo ako na makatapos sa pagaaral ko hanggang kolehiyo, kasi po ang nagpapaaral sa akin ay ang lola ko lamang.",,,
