full_nameyears,sentence,label,sentiment_label,sentiment_score
2007 Arroyo,"tapos na ang halalan pamumulitika panahon na para maglingkod nang walang damot, mamuno nang walang pangamba maliban sa kagalingan ng bayan, govern wisdom, compassion, vision, patriotism.",,,
2007 Arroyo,hangarin kong mapabilang ang pilipinas sa mayayamang bansa sa loob ng dalawampung taon.,,,
2007 Arroyo,"then, poverty shall marginalized marginalized raised robust middle class.",,,
2007 Arroyo,"achieved hallmarks modern society, institutions strong.",,,
2007 Arroyo,", philippines well way achieving vision.",,,
2007 Arroyo,"tax reforms last congress, thank last congress, turned around macroeconomic condition fiscal discipline, toward balanced budget.",,,
2007 Arroyo,"binabayaran ang utang, pababa ang interes, paakyat ang pondo para sa progreso ng sambayanang pilipino!!!",,,
2007 Arroyo,maraming salamat ulit sa nakaraang congress.,,,
2007 Arroyo,investing hundreds billions human physical infrastructure.,,,
2007 Arroyo,"next three years see record levels well thought generous funding following priorities first, investments physical, intellectual, legal, security infrastructure increase business confidence.",,,
2007 Arroyo,imprastraktura para sa negosyo trabaho.,,,
2007 Arroyo,isang milyong trabaho tauntaon.,,,
2007 Arroyo,"second, investments stronger wider social safety net—murang gamot, abotkayang pabahay, eskwelang primera klase, mga gurong magaling mas malaki ang kita, mga librong dekalidad, scholarships gifted students, language instruction maintain lead english proficiency.",,,
2007 Arroyo,dunong kalusugan ang susi sa kasaganaan.,,,
2007 Arroyo,"third, investments bringing peace mindanao crushing terrorism wherever threatens regardless ideology putting stop human rights abuses whatever excuse.",,,
2007 Arroyo,pay tribute fearless savagely massacred tipotipo trying pursue peaceful progressive philippines.,,,
2007 Arroyo,disappoint hopes.,,,
2007 Arroyo,waste sacrifice.,,,
2007 Arroyo,swayed course set conflict peace justice throughout land.,,,
2007 Arroyo,"created philippine model reconciliation built interfaith dialogue, expanded public works, responsive social services.",,,
2007 Arroyo,"investments show sides mindanao conflict stake common greater reason together hang apart, including together isolating terrorists.",,,
2007 Arroyo,"imprastraktura ang haliging nagtitindig hindi lamang ng kapayapaan kundi ng ating buong makabagong ekonomiya mga kalsada, tulay, paliparan, public parks, power plants.",,,
2007 Arroyo,"last year unveiled super regions—mindanao, central philippines, north luzon agribusiness quadrangle, luzon urban beltway, cyber corridor—to spread development away inequitable concentration metro manila.",,,
2007 Arroyo,hindi lamang maynila ang pilipinas.,,,
2007 Arroyo,super regions gimmick occasion blueprint building future.,,,
2007 Arroyo,"mindanao, food basket, said would prioritize agribusiness investments.",,,
2007 Arroyo,"have, happy see latest survey june hunger rate sharply gone nationwide.",,,
2007 Arroyo,"departments agriculture, agrarian reform, environment natural resources devote percent program budgets mindanao.",,,
2007 Arroyo,recommendation articulated congressman rufus rodriguez peace security summit cagayan de oro.,,,
2007 Arroyo,department agrarian reform move davao.,,,
2007 Arroyo,dapat maging daan sa tagumpay sa agribusiness ang reporma sa lupa.,,,
2007 Arroyo,"done right, reform democratize success, ramon magsaysay diosdado macapagal envisioned.",,,
2007 Arroyo,must reform agrarian reform transform beneficiaries agribusinessmen agribusinesswomen.,,,
2007 Arroyo,"sa gayon, dadami pa ang mga tampok na magsasaka gaya ng mga nagwagi ng gawad saka, sina ananias cuado ng comval demetrio tabelon ng butuan nelson taladhay ng sultan kudarat, pangunahing agrarian reform beneficiary ng .",,,
2007 Arroyo,"also outstanding farmers super regions, like joseph fernando heherson pagulayan, nestor bautista, joseph lomibao, arturo marcaida, peter uy, arturo pasacas, glenn saludar.",,,
2007 Arroyo,congratulations you!,,,
2007 Arroyo,sa anim na taon nagtayo tayo nagayos ng patubig para sa milyong ektarya sa buong bansa—pinakamalaki sa matagal na panahon.,,,
2007 Arroyo,magtatayo tayo ng mariculture palaisdaan sa dagat.,,,
2007 Arroyo,"isa rito ay ilalagay natin sa sibutu, sa tawitawi.",,,
2007 Arroyo,hiling ito ni nur jaafar.,,,
2007 Arroyo,"para sa buong bansa naglaan tayo ng billion para sa , kilometro ng farmtomarket roads , kilometro sa mindanao.",,,
2007 Arroyo,gawa na ang .,,,
2007 Arroyo,road roro network cut cost bringing agribusiness products mindanao luzon.,,,
2007 Arroyo,"used pay , dapitan batangas.",,,
2007 Arroyo,"pays ,.",,,
2007 Arroyo,"fresh fish cost , ton move, travels ,.",,,
2007 Arroyo,"construction crisscrossing mindanao dapitandakak bring cely carreons paradise closer civilization sibucosirawaysioconbaliguian dinagat island network, baptismal gift glenda ecleos new province manaymati section davaosurigao maguindanaolebak, sim datumanongs brainchild headed dpwh.",,,
2007 Arroyo,"want better airports, new bridges, ample energy mindanaos rising economy.",,,
2007 Arroyo,dipolog pagadian airports improved years end.,,,
2007 Arroyo,also cotabato airport.,,,
2007 Arroyo,"doubt eagerly awaited au cerilles, rolando yebes, digs dilangalen, ros labadlabad, victor yu, mayors evelyn uy sammy co. last july inaugurated .",,,
2007 Arroyo,"billion, bridge butuan, built initiative mayor boy daku plaza, near billion secondgeneration flood control project also built.",,,
2007 Arroyo,first built father great flood butuan .,,,
2007 Arroyo,kailangan ipagtanggol ang kapaligiran mamamayan sa sakuna.,,,
2007 Arroyo,"agusan del norte, hope edel amante happy plans pilot micro agribusiness jabonga.",,,
2007 Arroyo,"july , ozamis airport opened, bankrolled partly leo ocampos, aldo parojinog, hermie ramiros congressional fund.",,,
2007 Arroyo,"now, thats kind pork good cholesterol.",,,
2007 Arroyo,occasion mou signed pangil bay bridge connect ozamis lanao del norte iligan.,,,
2007 Arroyo,"urged bobby dimaporo, declared mt.",,,
2007 Arroyo,inayawan range protected nature park.,,,
2007 Arroyo,"mayor lawrence cruzs recommendation, instruct dpwh build iligan circumferential road.",,,
2007 Arroyo,", opened solar plant cagayan de oro.",,,
2007 Arroyo,"still, mindanao faced gap clean coal plant phividec fill gap.",,,
2007 Arroyo,count oca moreno excongressmannowcitymayor tinex jaraula continue providing good investment climate.,,,
2007 Arroyo,thank miriam defensorsantiago migz zubiri sponsoring biofuels law last congress.,,,
2007 Arroyo,", hectares jatropha nurseries bukidnon , general santos.",,,
2007 Arroyo,"jatropha percent substitute diesel, percent emission.",,,
2007 Arroyo,mindanaos energy challenge lies generating power power lines.,,,
2007 Arroyo,terrorists target transmission towers.,,,
2007 Arroyo,must resolutely apply human security act.,,,
2007 Arroyo,"act first filed johnny enrile , three years first world trade center bombing, four years rizal day bombing, five years .",,,
2007 Arroyo,ably crafted final senate version senate president manny villar nene pimentel.,,,
2007 Arroyo,"lets go central philippines, tourism super region and, north luzon agribusiness quadrangle luzon urban beltway, top magnet industry investment cyber corridor encompasses centers technology learning running length super regions, baguio clark metro manila cebu davao neighboring areas.",,,
2007 Arroyo,"philippines ranks among top offshoring hubs world cost competitiveness importantly highly trainable, english proficient, itenabled management manpower.",,,
2007 Arroyo,"ability warren ambat baguio city high innovative teacher leadership award cambodia last february, topping contestants countries.",,,
2007 Arroyo,congratulations baguio warren!,,,
2007 Arroyo,information technology help bir bring taxes coming months.,,,
2007 Arroyo,revenue watch dashboard monitor revenue collections real time national level examiners.,,,
2007 Arroyo,"lgu revenue assurance share information bir lgus uncover fraud nonpayment, heads would roll per danny suarezs attrition law.",,,
2007 Arroyo,"strength contact centers well established, focused growing higher valueadded services, including accounting, legal, human resources, administrative services.",,,
2007 Arroyo,"and, taiwan tremor cut cyber services global clients, thanks pldt globe investing billion new international broadband links regional hubs redundancy cyberspace.",,,
2007 Arroyo,"business services sector become fastest growing economy providing , jobs compared , .",,,
2007 Arroyo,"forecast million jobs earning billion, amount remitted overseas filipinos today.",,,
2007 Arroyo,"safety net education last year said todays global economy, knowledge greatest creator wealth.",,,
2007 Arroyo,mahusay na edukasyon ang pinakamabuting pamana natin sa ating mga anak.,,,
2007 Arroyo,yun din ang tanging pamana na ayon sa batas kailangang ibigay sa bawat mamamayan.,,,
2007 Arroyo,"year, investing education billion, billion last year.",,,
2007 Arroyo,"and, last year government private sector built , classrooms instead usual ,.",,,
2007 Arroyo,"noon, isang libro bawat limang magaaral.",,,
2007 Arroyo,"ngayon, tigisang aklat na bawat grade schooler.",,,
2007 Arroyo,"one third public high schools internet access, private sector support.",,,
2007 Arroyo,scarcity public high schools surplus private high schools.,,,
2007 Arroyo,"instead building high schools, give high school scholarships—, scholars year.",,,
2007 Arroyo,"college, launched billion fund college loans, increase beneficiaries , ,.",,,
2007 Arroyo,"teachers, created , teaching positions.",,,
2007 Arroyo,improve training.,,,
2007 Arroyo,"benefits, too.",,,
2007 Arroyo,"salamat, dating senador tessie oreta dating congressman dodong gullas, na di na kailangan ng mga guro maghabol sa maynila ng sweldo pension.",,,
2007 Arroyo,pinoproseso na sa rehiyon sa regionalization ng payroll.,,,
2007 Arroyo,teachers national government employees matter get raise effective end month.,,,
2007 Arroyo,"sa tesda, bukod sa mga sariling kurso, nagbibigay ito ng mga scholarship sa vocational schools million noong isang taon, billion ngayon.",,,
2007 Arroyo,may billion pa ang dole.,,,
2007 Arroyo,"investing billion science engineering research development technology, including scholarships masters doctoral degrees engineering seven universities.",,,
2007 Arroyo,"upgrade knowhow learning, filipino talent unbeatable.",,,
2007 Arroyo,proof biochemist baldomero olivera university utah named scientist year harvard foundation.,,,
2007 Arroyo,"international math science olympiad jakarta, robert buendia cavite central school wilson alba san beda alabang gold.",,,
2007 Arroyo,"congratulations, guys!",,,
2007 Arroyo,"six filipinos bagged awards intel young scientists competition new mexico last may ivy ventura, mara villaverde, hester mana umayam, janine santiago philippine science high melvin barroa capiz national high, congratulations, melvin luigi john suarez benedicto national high.",,,
2007 Arroyo,congratulations naman.,,,
2007 Arroyo,last week filipino students topbilled amiel sy philippine science high dominated mathematics world contest hong kong.,,,
2007 Arroyo,"congratulations, amiel.",,,
2007 Arroyo,congratulations philippine science high.,,,
2007 Arroyo,earlier month diona aquino presidential management staff team youth innovation competition global governance shanghai.,,,
2007 Arroyo,ito ay malaking kunsuwelo sa atin.,,,
2007 Arroyo,spent human capital formation ever past.,,,
2007 Arroyo,"government people people well, mockery democracy.",,,
2007 Arroyo,"may malaking pagangat ang kalagayan ng maralita, gaya ng trabaho, pagaaral, paggamot.",,,
2007 Arroyo,look chart fare poor.,,,
2007 Arroyo,"sa unang pagkakataon, gumastos ang philhealth ng higit bilyon sa paospital ng maralita.",,,
2007 Arroyo,noong sinabi kong hahatiin natin ang presyo ng gamot na madalas bilhin ng madla.,,,
2007 Arroyo,"ngayon , botika ng barangay ang nagtitinda ng murang gamot.",,,
2007 Arroyo,ang paracetamol na tatlong piso sa labas ay piso lamang sa botika ng barangay.,,,
2007 Arroyo,ang antibiotic na binibenta ng mga pangunahing parmasya sa ay lamang.,,,
2007 Arroyo,"kaya sa isang survey, halos kalahati ang nagsabing abotkaya ang gamot, kumpara sa percent noong .",,,
2007 Arroyo,"spread even more, ask congress pass cheaper medicines bill almost enacted june.",,,
2007 Arroyo,almost good enough.,,,
2007 Arroyo,"lets help mar roxas ferge biron teddy boy locsin give people meaningful, affordable choices, abroad philippines.",,,
2007 Arroyo,also ask congress pass legislation brings improved longterm care senior citizens.,,,
2007 Arroyo,asahan natin si ed angara.,,,
2007 Arroyo,si noli de castro na isa pang kampeon ng senior citizens ay namumuno ng ating programa sa pabahay.,,,
2007 Arroyo,"congratulations, noli.",,,
2007 Arroyo,low interest rates housing unprecedented.,,,
2007 Arroyo,"naglaan ang pagibig ng billion na pautang, six times amount started .",,,
2007 Arroyo,billion pa ang ilalaan hanggang .,,,
2007 Arroyo,terrorism human rights fight terrorism.,,,
2007 Arroyo,"threatens sovereign, democratic, compassionate, decent way life.",,,
2007 Arroyo,"therefore, fight lawless violence, must uphold values.",,,
2007 Arroyo,never right always wrong fight terror terror.,,,
2007 Arroyo,"ask congress  urge enact laws transform state response political violence first, laws protect witnesses lawbreakers law enforcers.",,,
2007 Arroyo,"second, laws guarantee swift justice empowered special courts.",,,
2007 Arroyo,"third, laws impose harsher penalties political killings.",,,
2007 Arroyo,"fourth, laws reserving harshest penalties rogue elements uniformed services betray public trust bring shame greater number colleagues patriotic.",,,
2007 Arroyo,must wipe stain democratic record.,,,
2007 Arroyo,ngunit pangunahing pakikibaka pa rin para sa karapatan ang pagpapalaya ng masa sa gutom kahirapan.,,,
2007 Arroyo,together economic prosperity need strengthen institutions government.,,,
2007 Arroyo,lets start election reform.,,,
2007 Arroyo,long provided funds computerization.,,,
2007 Arroyo,"look forward modernization voting, counting, canvassing.",,,
2007 Arroyo,disagree political goals never conduct democratic elections.,,,
2007 Arroyo,"ask congress fund poll watchdogs, enact stronger law electionrelated violence.",,,
2007 Arroyo,must weed corruption build strong system justice people trust.,,,
2007 Arroyo,provided unprecedented billions antigraft efforts.,,,
2007 Arroyo,"thus ombudsmans conviction rate hit percent year, percent .",,,
2007 Arroyo,"implemented lifestyle checks, dormant half century.",,,
2007 Arroyo,"tauntaon dosedosenang opisyal ang nasususpinde, napapatalsik, kinakasuhan dahil labislabis sa suweldo ang gastos ariarian nila.",,,
2007 Arroyo,"firms asked bribes taxes, permits, licenses dropped onethird onehalf.",,,
2007 Arroyo,contract bribes also down.,,,
2007 Arroyo,graft wont eliminated overnight making progress.,,,
2007 Arroyo,conclusion outlined today sampler .,,,
2007 Arroyo,trillion medium term public investment program.,,,
2007 Arroyo,"fund trillion state revenues, tax reforms firm orders bir customs hit targets.",,,
2007 Arroyo,billion state corporations.,,,
2007 Arroyo,"balance government financial institutions, private sector investments, local government equity, bilateral multilateral partners.",,,
2007 Arroyo,"new confidence momentum progress imbued foreign relations, asean summit last year coming asean regional forum, increased assistance allies continued support peace security efforts mindanao.",,,
2007 Arroyo,able strengthen economy fiscal reforms adopted great cost public disapproval.,,,
2007 Arroyo,would rather right popular.,,,
2007 Arroyo,fundamentals paying huge leaps investment.,,,
2007 Arroyo,"anim na milyong trabaho ang nalikha sa anim na taon, sustainable enterprises.",,,
2007 Arroyo,"sa lakas ng piso, bumagal ang pagtaas ng bilihin.",,,
2007 Arroyo,ardent wish vision outlined fully achieved step down.,,,
2007 Arroyo,"unshakable resolve fundamentals vision permanently rooted, progress well advanced, direction firmly fixed reforms already bearing fruit.",,,
2007 Arroyo,remain successor gather harvest.,,,
2007 Arroyo,easier time did.,,,
2007 Arroyo,"say campaign next election started may , day last.",,,
2007 Arroyo,fine.,,,
2007 Arroyo,stand way ones ambition.,,,
2007 Arroyo,ask one stand way peoples wellbeing nations progress.,,,
2007 Arroyo,time facing over.,,,
2007 Arroyo,time facing forward better future people desperately want richly deserve.,,,
2007 Arroyo,uulitin ko hindi ako sagabal sa ambisyon ninuman.,,,
2007 Arroyo,make mistake.,,,
2007 Arroyo,stand idly anyone gets way national interest tries block national vision.,,,
2007 Arroyo,"sit, tell you, president always strong wants be.",,,
2007 Arroyo,pagpalain tayo ng diyos ang dakilang gawaing hinaharap natin.,,,
2007 Arroyo,state nation strong.,,,
2007 Arroyo,"inyong lingkod, gloria macapagalarroyo, pangulo ng republika ng pilipinas.",,,
2007 Arroyo," eighth state nation address excellency gloria macapagalarroyo president philippines opening regular session congress thank you, speaker nograles.",,,
2007 Arroyo,senate president villar.,,,
2007 Arroyo,senators representatives.,,,
2007 Arroyo,"vice president de castro, president ramos, chief justice puno, members diplomatic corps, ladies gentlemen address today crucial moment world history.",,,
