full_nameyears,sentence,label,sentiment_label,sentiment_score
2014 Aquino,"albay, recently endure wrath typhoon glenda, recorded casualties attributed storm, thanks effective leadership governor joey salceda.",,,
2014 Aquino,"province considered highway storms achieve this, doubt lgus achieve let us talk security.",,,
2014 Aquino,"aware challenges country faces, also know high cost equipment need.",,,
2014 Aquino,"today, glad report ongoing modernization afp.",,,
2014 Aquino,"acquired brand new assets, including sokol combat utility helicopters, helicopters, first landing craft utility ship built right country brp tagbanua.",,,
2014 Aquino,"refurbished helicopters navy cutters also arrived.this past may, also inaugurated naval forces wests stateoftheart command center palawan.",,,
2014 Aquino,"next year, leadin fighter jets procured arrive country.",,,
2014 Aquino,expect rest delivered .,,,
2014 Aquino,"also targeting acquisition additional bell combat utility helicopters, antisubmarine helicopters, helicopters, lightlift aircraft, mediumlift aircrafts, radar systems, brand new.",,,
2014 Aquino,"these, along new equipment, boost capacity armed forces.",,,
2014 Aquino,"meanwhile, expecting delivery additional refurbished helicopters september year.",,,
2014 Aquino,assault rifles bought soldiers likewise arrived.,,,
2014 Aquino,"next months, total number rifles hands soldiers , units.",,,
2014 Aquino,"top this, correct transparent procurement process honest management funds, able save .",,,
2014 Aquino,billion pesos.,,,
2014 Aquino,use purchase even rifles.,,,
2014 Aquino,must emphasize rifles brand new good quality veteran manufacturer.,,,
2014 Aquino,"true that, before, funds depleted purchase kevlar helmets even according specification instead buying u.s., helmets purchased another country.",,,
2014 Aquino,already conviction matter.,,,
2014 Aquino,"investigation judge allegedly involved, ordered supreme court, concluded well, awaiting verdict.",,,
2014 Aquino,continuing pursuit enemies state lawless elements crimes committed.,,,
2014 Aquino,example apprehended chairman secretary general npa march.,,,
2014 Aquino,normality order returning provinces previously troubled npa.,,,
2014 Aquino,image police changed.,,,
2014 Aquino,"proof policemen, led inspector charity galvez, repelled estimated npa members stormed precinct .",,,
2014 Aquino,"last march, four rookie policewomen bravely exchanged fire martilyo gang mall asia.",,,
2014 Aquino,"indeed fortunate already reached policetopistol ratio, rookie policewomen issued brand new guns.",,,
2014 Aquino,"before, needs police force went ignored today, state taking care them, indeed, matching support efficient upright service.",,,
2014 Aquino,"let us listen brave policewomen testimonials juliet macababbad, marcelina bantiyag, maricel rueco, delia langpawen—policewomen arrested members martilyo gang juliet macababbad heard glass breaking, partner immediately went alert.",,,
2014 Aquino,"marcelina bantiyag first thing came mind draw gun, knew would ready shoot us—we uniform.",,,
2014 Aquino,"maricel rueco partner, bantiyag said, ill cover you.",,,
2014 Aquino,call police community precinct.,,,
2014 Aquino,marcelina bantiyag caught one gang members.,,,
2014 Aquino,"delia langpawen fourth day job, post.",,,
2014 Aquino,happened.,,,
2014 Aquino,juliet macababbad every police officer needs gun.,,,
2014 Aquino,"thankfully, issued us glock generation .",,,
2014 Aquino,marcelina bantiyag guns essential us.,,,
2014 Aquino,"something bad happens youre patrol, youre confident engage.",,,
2014 Aquino,juliet macababbad feels good know youre able help fellow citizens.,,,
2014 Aquino,"whatever man do, woman well.",,,
2014 Aquino,"delia langpawen even nervous, first encounter, thinking safety people there.",,,
2014 Aquino,"past june, succession highprofile killings.",,,
2014 Aquino,"already arrested thoseinvolved murders mayor ernesto balolong businessman richard king, currently following strong lead murder case race car driver ferdinand pastor.",,,
2014 Aquino,"rest assured seeking justice all, few.",,,
2014 Aquino,"why, top arrests already made, continue gather evidence suspects.",,,
2014 Aquino,hold account committed wrongdoing.,,,
2014 Aquino,strengthening ways ensure security citizens.,,,
2014 Aquino,"beginning june year, implemented operation lambat national capital region.",,,
2014 Aquino,"tripling number checkpoints conducting various operations, able confiscate vehicles firearms.",,,
2014 Aquino,"served warrants arrest, resulted arrest suspects.",,,
2014 Aquino,"also reinstated oplan katok, ensure licensing guns limited responsible owners.",,,
2014 Aquino,"policemen knocked , doors operation.",,,
2014 Aquino,"implemented operation lambat, january second week june, rate murder homicide cases metro manila reached cases week.",,,
2014 Aquino,"five weeks operation lambat, murder homicide cases decreased cases per week.",,,
2014 Aquino,"percent decrease, equivalent nine murders prevented per week.",,,
2014 Aquino,metro manila.,,,
2014 Aquino,"able pass pension reform, would enable us gather even funds continue planned purchases equipment, secretary mar roxas certainly able expand operation lambat, thus make whole country secure.",,,
2014 Aquino,"equipment purchases supposed funded dap, since obligated supreme court made decision, look sources funds.",,,
2014 Aquino,"indeed, trust foundation good governance trust affected—or affected—by typhoons cared trust that, day work, able return home safely families trust leaders take advantage trust government always side, especially find disadvantage.",,,
2014 Aquino,"trust abuse power held accountable, trust institutions processes abused used steal nations coffers reformed.",,,
2014 Aquino,"trust that, right, you, turn, receive deserve.",,,
2014 Aquino,restoration trust government meaning reform.,,,
2014 Aquino,"let give example customs, sorely testing patience past years.",,,
2014 Aquino,became clear us solution problem agency represented reset button.,,,
2014 Aquino,"thus, created new agency look processes customs, eye towards making efficient.",,,
2014 Aquino,"appointed new commissioner, five new deputy commissioners, well trustworthy individuals implement reforms.",,,
2014 Aquino,"ensured employees recalled original positions—we put stop guards acted like cashiers, warehousemen acted examiners.",,,
2014 Aquino,many made sacrifices fix customs.,,,
2014 Aquino,"among officials departments government agencies, asked transfer customs certain integrity.",,,
2014 Aquino,"would said yes taking seemingly insurmountable challenges, without guarantee success passed promotions.",,,
2014 Aquino,"expressed fears targeted syndicates, retaliation reforms.",,,
2014 Aquino,"but, ultimately, heeded call serve.",,,
2014 Aquino,"right take opportunity personally thank officials, leadership commissioner sunny sevilla.",,,
2014 Aquino,"proving that, righteousness solidarity, clean institution has, longest time, besmirched corruption.",,,
2014 Aquino,"recent good news testament this—from january april , customs cash collections increased percent, compared period last year.",,,
2014 Aquino,collections total first four months year billion pesos.,,,
2014 Aquino,"say continue selfish, illegal practices already know impervious fear shame.",,,
2014 Aquino,"leave conscience—if feel remorse fellowmen become addicted illegal drugs helped smuggle in, farmers deprived fair profit honest work.",,,
2014 Aquino,"far concerned gathered enough evidence you, bilibid prison next destination.",,,
2014 Aquino,"talking reforms already begun give rise sweeping progress, touch recent developments agrarian reform.",,,
2014 Aquino,know—and law clear this—that must first determine tracts land distributed cannot.,,,
2014 Aquino,"trouble is, provided data insufficient help regard.",,,
2014 Aquino,"cadastral survey—which supposed accurately delineate territory, and, thus, land holdings, every town, city, province philippines—was launched way back .",,,
2014 Aquino,"another problem previous administration distributed land easy enough distribute—like governmentowned land, land already settled farmers deedholders.",,,
2014 Aquino,left land came many complications—that spawned endless debates legal disputes.,,,
2014 Aquino,complicated situation armm proved another challenge.,,,
2014 Aquino,land armm estimated .,,,
2014 Aquino,"million hectares, recorded number hectares found came office .",,,
2014 Aquino,"million, thanks overlapping claims.",,,
2014 Aquino,"armm governor mujiv hataman must wondering—as sometimes asked land multiply like intention passing problems successor, cause even greater complications standstill agrarian reform.",,,
2014 Aquino,", years, cadastral survey finally completed.",,,
2014 Aquino,"year, submit congress bill extending filing notices coverage, could completed precisely problems first needed solve.",,,
2014 Aquino,"hopeful that, moment file bill, congress pass soonest possible time.",,,
2014 Aquino,"speak trust, cannot forget bangsamoro.",,,
2014 Aquino,"lengthy period conflict derailed negotiations, able put trust back table.",,,
2014 Aquino,"proof past march, comprehensive agreement bangsamoro signed.",,,
2014 Aquino,beginning path toward widespread progress mindanao.,,,
2014 Aquino,nobody deny armm left behind terms development.,,,
2014 Aquino,"want give equal opportunities filipinos need boostup, countrymen margins catch up.",,,
2014 Aquino,"example, budget submitting , .",,,
2014 Aquino,billion pesos overall budget dpwh allocated infrastructure armm.,,,
2014 Aquino,currently forging proposal bangsamoro basic law.,,,
2014 Aquino,ask congress understanding regarding this.,,,
2014 Aquino,important scrutinize provision lay down.,,,
2014 Aquino,"best ability, aim advance bill fair, just, acceptable all.",,,
2014 Aquino,"able legislate bangsamoro basic law end year conduct necessary plebiscite, able give bangsamoro transition authority one half years show positive change.",,,
2014 Aquino,"delayed, however, period proving right choose path peace naturally shortened.",,,
2014 Aquino,achieved lot trust—and intention breaking trust.,,,
2014 Aquino,current government keeps word.,,,
2014 Aquino,"longer list promises fulfilled treading straight path that, might accused bragging.",,,
2014 Aquino,"course, would right us avoid mentioning anything, critics always waiting opportunity say done nothing.",,,
2014 Aquino,"join me, then, recounting examples promises fulfilled jobs opportunities continue created many filipinos.",,,
2014 Aquino,"truth, april april , around .",,,
2014 Aquino,million jobs created.,,,
2014 Aquino,"inherited backlog books, chairs, classrooms erased working fulfill new needs brought implementation k .",,,
2014 Aquino,policetopistol ratio already reached.,,,
2014 Aquino,"modernization armed forces, currently ongoing.",,,
2014 Aquino,"lasting peace mindanao, already advancing.",,,
2014 Aquino,"growth economy, progressing continuously.",,,
2014 Aquino,"truly, ambitions fulfilled one one universal healthcare, classrooms, jobs, harbors, roads, airports, security, peace.",,,
2014 Aquino,addition national integrity restored worlds recognition new philippines.,,,
2014 Aquino,"nations coffers, come sweat citizens, spent benefit.",,,
2014 Aquino,"let us listen one bosses testimonial gina lastrado, relocated member informalsettler family gina lastrado, years old.",,,
2014 Aquino,"used live isla barangay , maricaban, pasay city.",,,
2014 Aquino,businesswoman back pasay.,,,
2014 Aquino,"currently, still make living selling goods its job demands hard work.",,,
2014 Aquino,relocated place used live tagged danger zone—most houses right beside river.,,,
2014 Aquino,"typhoon ondoy hit, terrible.",,,
2014 Aquino,wouldnt believed would survive.,,,
2014 Aquino,"compare lives back pasay lives now—here, rains, storms, sleep night.",,,
2014 Aquino,"theres lying awake, worrying coming flood—not like used live.",,,
2014 Aquino,"told friends, stayed behind, relocate, too.",,,
2014 Aquino,"theres fear, theres flood.",,,
2014 Aquino,"got here, gave us groceries, gave us key house, brought us house.",,,
2014 Aquino,"eighteen thousand pesos gave us, helped us start new life.",,,
2014 Aquino,"gave us back dignity, us living squatters area back pasay.",,,
2014 Aquino,lives much better here.,,,
2014 Aquino,say really home now.,,,
2014 Aquino,"problems inherited, solved.",,,
2014 Aquino,"problems today, solving.",,,
2014 Aquino,"problems still horizon, preparing for.",,,
2014 Aquino,"believe continued trust, solve these.",,,
2014 Aquino,let us turn energy situation.,,,
2014 Aquino,everything power ensure growing energy demand country met.,,,
2014 Aquino,"spite this, unforeseen events, may lead problems next year.",,,
2014 Aquino,"instance, need make shortages caused scheduled maintenance outages old plants, sudden halting plant operations due breakdowns, delays progress new plants.",,,
2014 Aquino,"let us forget coming el niño season also threatens affect capacities hydro power plants, raise energy demand even further.",,,
2014 Aquino,"use electric fans air conditioners homes increase due warm temperature, imagine spike usage businesses whole industries.",,,
2014 Aquino,"go store ask buy megawatt generator, installed following day.",,,
2014 Aquino,want completely ready avoid paralysis worstcase scenario arises.,,,
2014 Aquino,goal planned solutions problems arise next year.,,,
2014 Aquino,"precisely tasked secretary icot petilla doe coordinate joint congressional power commission, energy regulatory commission, members industry, and, importantly, consumers, order increase capacity respond problem.",,,
2014 Aquino,also aware many bosses affected staggering increase rice prices.,,,
2014 Aquino,"seems reports true greedy rice hoarders stockpiling supplies order sell prices eventually rise, making unjust profit process.",,,
2014 Aquino,let pass.,,,
2014 Aquino,"perhaps think clever, governments plan action prove opposite.",,,
2014 Aquino,"immediate solution import rice, supply markets, reduce prices keep reasonable level, ultimately drive took advantage filipino people financial ruin.",,,
2014 Aquino,"last november, imported , metric tons rice supplement decreased supply due typhoons battered country, arrived march year.",,,
2014 Aquino,"february, nfa council approved importation additional , metric tons, fulfillment buffer stocking requirement, july, , amount arrived.",,,
2014 Aquino,"july well, approved immediate importation , metric tons rice open bidding.",,,
2014 Aquino,"nfa also standby authority import additional , metric tons prepare effects calamities harvests rice prices.",,,
2014 Aquino,"additional rice imported arrives country, hoarders forced sell rice stockpiled warehouses.",,,
2014 Aquino,"hoarders showdown want, means, take government.",,,
2014 Aquino,remember takes six months stock hoarded warehouses begins rot.,,,
2014 Aquino,"flood market imported rice, surely go bust.",,,
2014 Aquino,"acting filipino people, acting interest filipino.",,,
2014 Aquino,let us see prevail.,,,
2014 Aquino,"apart investigating allegedly hoarded nfa rice, also probing concerned agencies may conspired hoarders.",,,
2014 Aquino,"employees suspected wrongdoing already scrutiny, may file charges, eventually, imprison must held account.",,,
2014 Aquino,"pursuit abusive few, also continued implement projects uplift filipinos sector agriculture.",,,
2014 Aquino,ensuring rice farming remains viable attractive livelihood.,,,
2014 Aquino,"all, know farmers advancing age, help pursuit food security encourage youth enter kind work.",,,
2014 Aquino,providing farmers modern equipment ensure efficiency planting harvest.,,,
2014 Aquino,"may , already turned , units production machinery, , units postproduction machinery, rice mills number farmers associations.",,,
2014 Aquino,allowed us lessen waste farmers able harvest.,,,
2014 Aquino,"top also enhancing irrigation systems, constructing farmtomarket roads, implementing training programs ensure make maximum profit.",,,
2014 Aquino,"now, let us turn budget.",,,
2014 Aquino,"executive branch proposes projects, approved congress.",,,
2014 Aquino,"however, suspend number projects make certain remain accordance supreme courts decision disbursement acceleration program, dap.",,,
2014 Aquino,"know hall one believing must deprive countrymen benefits, reach soonest possible time.",,,
2014 Aquino,"proposing passage supplemental budget , implementation programs projects need compromised.",,,
2014 Aquino,"together this, calling cooperation congress passage joint resolution bring clarity definitions ideas still debated upon, issues legislature—as authors laws—can shed light on.",,,
2014 Aquino,"first working day sona, submit congress proposed .",,,
2014 Aquino,trillion peso national budget .,,,
2014 Aquino,"always, budget created together countrymen, using strategies ensure funds allocated projects programs truly benefit public.",,,
2014 Aquino,"counting cooperation lawmakers strengthen budget, primary instrument creating opportunities filipino people.",,,
2014 Aquino,"let us listen one beneficiaries alternative learning system, program department education.",,,
2014 Aquino,"testimonial maria cecilla fruelda—aeta tribal leader, alternative learning system learner, college student maria cecilla fruelda.",,,
2014 Aquino,"heard friends also came zambales, living rosario, good jobs found puting kahoy.",,,
2014 Aquino,thats moved here.,,,
2014 Aquino,"first priority tribespeople always look food, rather invest time education.",,,
2014 Aquino,education important me.,,,
2014 Aquino,passing alternative learning system als first step realizing dream becoming teacher.,,,
2014 Aquino,think young aetas community would much better lives could study.,,,
2014 Aquino,"hadnt gotten als, wouldnt learned rights indigenous peoples.",,,
2014 Aquino,wouldnt able fight ancestral land.,,,
2014 Aquino,"right now, thank god, national commission indigenous peoples processing land titles awarded us.",,,
2014 Aquino,"graduate degree education, want teach community.",,,
2014 Aquino,want share aeta community everything ive learned more.,,,
2014 Aquino,als great help.,,,
2014 Aquino,student teodoro m. luansing college rosario helped bring attention community.,,,
2014 Aquino,lot people offered help.,,,
2014 Aquino,see communitys children following footsteps.,,,
2014 Aquino,lot school now.,,,
2014 Aquino,"fellow citizens, story—and stories many beneficiaries like her—that drowned din orchestra negativism news.",,,
2014 Aquino,noisy individuals willfully close minds choose live world reality.,,,
2014 Aquino,"transformation society becomes even apparent, people acting expect attacks us becoming frequent, venomous, intense.",,,
2014 Aquino,"benefits reform become clearer, becomes difficult succeed fooling people, sowing doubt uncertainty.",,,
2014 Aquino,become desperate.,,,
2014 Aquino,angry let us examine motivations.,,,
2014 Aquino,"turned public service business able fix systems, lose opportunity subvert systems gain.",,,
2014 Aquino,natural oppose us.,,,
2014 Aquino,"hand, goal overthrow government recruit members agreat number people suffering losing faith system.",,,
2014 Aquino,"why, reformed system ended peoples suffering, number potential recruits dwindled, explains group getting smaller smaller.",,,
2014 Aquino,natural oppose us.,,,
2014 Aquino,"noisiest loudest oppose us favor transformation country, precisely manipulated benefited old broken systems.",,,
2014 Aquino,citizens long trapped island one store.,,,
2014 Aquino,"since choices, store owners abused advantage, raising prices whenever wanted.",,,
2014 Aquino,"task gave steer ship state another island, stores, choices, better lives, opportunities.",,,
2014 Aquino,"course, running solitary store island want us set sail, run people abuse.",,,
2014 Aquino,would everything power prevent us reaching shores.,,,
2014 Aquino,"would say different there, nothing would change.",,,
2014 Aquino,"would detain us port, punch holes ship, conspire steer us astray.",,,
2014 Aquino,"truth one people oppose, entire filipino people reaping benefits straight path.",,,
2014 Aquino,"oppose farmers iloilo, hoped efficient irrigation systems fifty years, today witnessing construction jalaur multipurpose river project.",,,
2014 Aquino,oppose countless students longer study overcrowded classrooms.,,,
2014 Aquino,"oppose filipinos found jobs training received tesda filipinos safely evacuated typhoons strike pagasa efficient oppose informal settlers removed danger housing resettlement programs oppose poor receive treatment public hospitals free charge oppose soldiers who, equipment modernized, protect nation greater confidence oppose moros indigenous peoples who, today, see lasting peace horizon.",,,
2014 Aquino,"bosses, you.",,,
2014 Aquino,"fact, attacks began even came office.",,,
2014 Aquino,"grown used greeted negative commentators breakfast, personal attacks lunch, insults dinner, intrigue midnight snack.",,,
2014 Aquino,"even president, opposed change changed ways.",,,
2014 Aquino,"frank, think stop even stepped public office.",,,
2014 Aquino,recall old woman spoke campaign.,,,
2014 Aquino,"told noy, must take care yourself.",,,
2014 Aquino,many people.,,,
2014 Aquino,warning proved true.,,,
2014 Aquino,"resolve unshakeable comes facing down, know few, many us.",,,
2014 Aquino,"us ready fulfill part achieving positive transformation are, without doubt, stronger.",,,
2014 Aquino,triumph right.,,,
2014 Aquino,"dared dream, began pursuing dreams, worked hard, gained momentum, today, filipino people moving even faster along straight path lasting inclusive growth.",,,
2014 Aquino,fatigue sacrifices worthwhile able continue started together.,,,
2014 Aquino,face fork road decide change continue.,,,
2014 Aquino,let us remember fifth sona one remains.,,,
2014 Aquino,", choosing new leaders country.",,,
2014 Aquino,"tell wish continue even accelerate transformation society, one basis choosing successor will, without shred doubt, continue transformation achieving bosses, strength, bringing change –and you, too, continue task.",,,
2014 Aquino,entirely history remember era.,,,
2014 Aquino,"may recall peak triumphs, promising start went waste.",,,
2014 Aquino,would infinitely better remember achievements beginning long journey towards fulfillment even ambitious hopes.,,,
2014 Aquino,"groups appealed run president, told expect solve countrys problems span six years.",,,
2014 Aquino,simply asked begin change.,,,
2014 Aquino,"saw came from, seeing far surpassed aspirations began.",,,
2014 Aquino,"forging system fairness where, long follow rules, get want go true competition leads opportunity widespread progress every person take control destinies.",,,
2014 Aquino,"society least fortunate cared within reach person recognizes responsibilities fellowmen unceasing, untiring, everactive participation collectively increasing prosperity society.",,,
2014 Aquino,"future desire horizon one justice reigns supreme, one left behind.",,,
2014 Aquino,results reform.,,,
2014 Aquino,"fought for, continue fighting prevalence old ways, new system benefit all.",,,
2014 Aquino,bosses gave opportunity lead efforts transform society.,,,
2014 Aquino,"said no asked take challenge, could well said would help prolong suffering.",,,
2014 Aquino,cannot good conscience.,,,
2014 Aquino,"turned back opportunity, might well turned back father mother, sacrifices made us happen.",,,
2014 Aquino,"journey along straight path, always chosen right true promise, true you.",,,
2014 Aquino,"transformation experiencing now, make permanent guidance god.",,,
2014 Aquino,"long faith remains strong—as long continue serving others strength—we continue proving the filipino worth definitely dying for, the filipino worth living for, might add the filipino worth fighting for.",,,
2014 Aquino,vice president knows this—we together .,,,
2014 Aquino,"coup de etat, ambushed.",,,
2014 Aquino,everything consider second life.,,,
2014 Aquino,"its hard think things, considering people weve going against.",,,
2014 Aquino,"day go onstage, work, and—will someone manage plant bomb dark schemes want bring us back wrong way things finally succeed day comes, second life comes end, able say things ok tell this, straight eye everything weve achieved, say content.",,,
2014 Aquino,"content sure im gone, many take place continue started.",,,
2014 Aquino,maybe im meant start this.,,,
2014 Aquino,"people like cardinal chito tagle, ka eduardo manalo, brother eddie villanueva, father catalino arevalo, father jett villarin, bishop jonel milan, sister agnes guillen, mae salvatierra.",,,
2014 Aquino,"individuals religious sector, continue weve started.",,,
2014 Aquino,"aris alip card, part microfinance.",,,
2014 Aquino,alice murphy urban poor associates truly continue take care informal settlers.,,,
2014 Aquino,"soldiers police officers, try every day right—just like new chief staff, service commanders, soldiers light reaction battalion, jsog.",,,
2014 Aquino,"are, course, fellow politicians.",,,
2014 Aquino,"doubt senate president franklin drilon speaker belmonte lead us along right path also privilege work interact certain governor, alfredo maranon negros occidental party mate, think part fan club good governance negros.",,,
2014 Aquino,coming young politicians.,,,
2014 Aquino,least theyre younger am—i dont want seem much like old politico referring colleagues young.,,,
2014 Aquino,likes mayor jed mabilog mayor len alonte .,,,
