full_nameyears,sentence,label,sentiment_label,sentiment_score
2014 Aquino,also cultural sector—such noel cabangon ogie alcasid—who selfcentered.,,,
2014 Aquino,"every night, go bed, thankful able get another day.",,,
2014 Aquino,"said kids, finished finished, pass paper.",,,
2014 Aquino,"seems me, felt true extent change every filipinos right aspire to.",,,
2014 Aquino,carry forward.,,,
2014 Aquino,bosses behind transformation enjoying.,,,
2014 Aquino,key continuing positive changes achieved.,,,
2014 Aquino,"fully believe that, whether not, filipino headed towards rightful destination.",,,
2014 Aquino,"so, leave here.",,,
2014 Aquino,good afternoon you.,,,
2014 Aquino,thank much.,,,
2014 Aquino,basahin ayon sa pagkakabigkas,,,
2014 Aquino,"state nation address excellency benigno s. aquino iii president philippines congress philippines thank you, everyone.",,,
2014 Aquino,please sit down.,,,
2014 Aquino,"begin, would first like apologize.",,,
2014 Aquino,"wasnt able traditional processional walk, shake hands going receive me, feeling well right now.",,,
2014 Aquino,"vice president jejomar binay former presidents fidel valdez ramos joseph ejercito estrada senate president franklin drilon members senate speaker feliciano belmonte, jr. members house representatives chief justice maria lourdes sereno justices supreme court distinguished members diplomatic corps members cabinet local government officials members military, police, uniformed services fellow public servants and, bosses, beloved countrymen good afternoon all.",,,
2014 Aquino,sixth sona.,,,
2014 Aquino,"again, face congress countrymen report state nation.",,,
